id,sentence,VI,normalized-VI,homogeneity,completeness,V-score
900,"But the Reserve Fund , America 's first money fund , was not named , nor were the creators of the money-fund concept , Harry Brown and myself .",2.0502797209103845,0.29983195646659766,0.7501758390427594,0.656410762290325,0.7001680435334025
901,"We innovated telephone redemptions , daily dividends , total elimination of share certificates and the constant $ 1 pershare pricing , all of which were painfully thought out and not the result of some inadvertence on the part of the SEC .",3.2635179138294745,0.49955967291957193,0.5024904087652196,0.49840690544569716,0.5004403270804278
902,President,-0.0,nan,1.0,1.0,1.0
903,The Reserve Fund,0.666666666666667,0.26631956334878915,1.0,0.5793801642856952,0.7336804366512111
904,"The crowning moment in the career of Joseph F. O'Kicki came as 300 local and state dignitaries packed into his elegant , marble-columned courtroom here last year for his swearing in as President Judge of Cambria County .",3.1650225215666947,0.472444055772422,0.5459431825471501,0.5103669065384142,0.5275559442275777
905,Baskets of roses and potted palms adorned his bench .,1.0000000000000009,0.17718382013555808,0.9206955977827224,0.7437481019149278,0.8228161798644421
906,The local American Legion color guard led the way .,0.8754887502163458,0.16308286645303974,0.9182485351882309,0.7688208852920502,0.8369171335469602
907,"As the judge marched down the center aisle in his flowing black robe , he was heralded by a trumpet fanfare .",2.46540140716034,0.4048394195747335,0.6019438754184484,0.5885284634744029,0.5951605804252663
908,"To many , it was a ceremony more befitting a king than a rural judge seated in the isolated foothills of the southern Allegheny Mountains .",2.84032582430632,0.454244174960436,0.5762010834484796,0.5183664286564463,0.5457558250395639
909,"But then Judge O'Kicki often behaved like a man who would be king -- and , some say , an arrogant and abusive one .",2.2807820003461536,0.34108056626991456,0.6629626857074193,0.6549252004664649,0.6589194337300853
910,"While his case may be extreme , it reflects the vulnerability of many small communities to domineering judges .",2.3747060778296696,0.4017691917030199,0.5923265456196943,0.6042539624924643,0.5982308082969798
911,"Last March , nine months after the judge 's swearing-in , the state attorney general 's office indicted him on a sweeping array of charges alleging more than 10 years of `` official oppression '' in Cambria County , a depressed steel and mining community in western Pennsylvania .",3.382420852341256,0.5236558630875581,0.5054226521518662,0.4504295438498627,0.47634413691244193
912,"The allegations , ranging from theft and bribery to coercion and lewdness , paint a disquieting picture .",1.7924812503605771,0.30480735534475584,0.786297331556988,0.62300759504826,0.695192644655244
913,"According to testimony in a public , 80-page grand-jury report handed up to the state attorney general , Judge O'Kicki extorted cash from lawyers , muscled favorable loans from banks and bullied local businesses for more than a decade .",2.985617441891105,0.4943065128598476,0.5515568621054008,0.46687188623169495,0.5056934871401524
914,"Prosecutors , in an indictment based on the grand jury 's report , maintain that at various times since 1975 , he owned a secret and illegal interest in a beer distributorship ; plotted hidden ownership interests in real estate that presented an alleged conflict of interest ; set up a dummy corporation to buy a car and obtain insurance for his former girlfriend -LRB- now his second wife -RRB- ; and maintained 54 accounts in six banks in Cambria County .",3.823246423255128,0.5648137688325269,0.4550982053634073,0.41694363894877334,0.43518623116747324
915,"In testimony recorded in the grand jury report , court employees said the judge , now 59 years old , harassed his secretaries , made imperial demands on his staff and hounded anyone who crossed him .",2.9141254022432825,0.4757076508800379,0.543658667235363,0.5062583138946829,0.5242923491199621
916,"Bailiffs claimed they were required to chauffeur him to and from work , mow his lawn , chop his wood , fix his car and even drop by his house to feed his two grown mutts , Dixie and Husky .",2.4401960315368427,0.3708759591894601,0.6465901168724615,0.612576753900039,0.6291240408105401
917,One former bailiff charged that the judge double-crossed him by reneging on a promise of a better paying job after pocketing a $ 500 bribe .,2.53362703772797,0.3862495354311266,0.6241987093152606,0.6036462404392456,0.6137504645688733
918,Some of the allegations are simply bizarre .,0.5,0.09090909090909091,0.909090909090909,0.909090909090909,0.9090909090909088
919,"Two former secretaries told the grand jury they were summoned to the judge 's chambers on separate occasions to take dictation , only to find the judge in his bikini underwear .",2.672595108520993,0.417252375903283,0.5945385782192822,0.5714152542643922,0.582747624096717
920,One secretary testified that the judge once called her to his office while wearing nothing at all .,2.278863889369659,0.3759889639555817,0.6212196183972165,0.6268276531002877,0.6240110360444183
921,"The judge , suspended from his bench pending his trial , which began this week , vehemently denies all the allegations against him , calling them `` ludicrous '' and `` imaginative , political demagoguery . ''",2.862770414948955,0.4403209549876144,0.6347919295073481,0.5004610954604483,0.5596790450123856
922,"He blames the indictment on local political feuding , unhappiness with his aggressive efforts to clear the courthouse 's docket and a vendetta by state investigators and prosecutors angered by some of his rulings against them .",3.2284821140883238,0.5050134889721019,0.5436753745202946,0.45430152513666927,0.4949865110278982
923,"`` I do n't know whose toes I 've stepped on , '' says the judge .",1.5005750002545266,0.23304268027469247,0.8749403186461051,0.6827001351127768,0.7669573197253076
924,"`` I 'll find out , eventually , who pushed the state police buttons into action . ''",2.200535581913158,0.37189475979068004,0.6764343685523501,0.586221537598691,0.6281052402093202
925,"Even if only some of the allegations stand up , however , they provide ample testimony to the awesome power of judges in rural communities .",2.792436882081837,0.4542834636732695,0.5592743191693701,0.5328005243449154,0.5457165363267303
926,"That power can sometimes be abused , particularly since jurists in smaller jurisdictions operate without many of the restraints that serve as corrective measures in urban areas .",2.4901970848410793,0.40428369659598445,0.5981894465945199,0.5932635258475455,0.5957163034040156
927,Lawyers and their clients who frequently bring business to a country courthouse can expect to appear before the same judge year after year .,2.5110276044371003,0.3969650104182951,0.6311162761079736,0.5773461835428316,0.603034989581705
928,"Fear of alienating that judge is pervasive , says Maurice Geiger , founder and director of the Rural Justice Center in Montpelier , Vt. , a public interest group that researches rural justice issues .",2.932720083259833,0.4605095659207297,0.5739619673544195,0.5089249533311763,0.53949043407927
929,"As a result , says Mr. Geiger , lawyers think twice before appealing a judge 's ruling , are reluctant to mount , or even support , challenges against him for re-election and are usually loath to file complaints that might impugn a judge 's integrity .",2.873928988446066,0.4328800816260079,0.5708928285976409,0.5633965494770455,0.5671199183739921
930,"Judge O'Kicki , a stern and forbidding-looking man , has been a fixture in the local legal community for more than two decades .",2.5372438745658803,0.4137250612047031,0.581748332791396,0.5908725406088277,0.586274938795297
931,"The son of an immigrant stonemason of Slovenian descent , he was raised in a small borough outside Ebensburg , the Cambria County seat , and put himself through the University of Pittsburgh Law School .",2.9690771620633427,0.44848551462356506,0.5921755142960162,0.5160785632890162,0.5515144853764349
932,"He graduated near the top of his class , serving on the school law review with Richard Thornburgh , who went on to become governor of Pennsylvania and , now , U.S. Attorney General .",2.6401036569687992,0.3896644496727179,0.678661499911255,0.554508968409275,0.6103355503272818
933,It was also in law school that Mr. O'Kicki and his first wife had the first of seven daughters .,1.7132331253245194,0.25454302059692985,0.7638716903850656,0.7279092183768906,0.74545697940307
934,He divorced his first wife three years ago and married the daughter of his court clerk .,1.5952597340449275,0.2611293895653083,0.750502668282344,0.7275936204382533,0.7388706104346918
935,"Last year , Pennsylvania Supreme Court Justice John P. Flaherty called Mr. O'Kicki one of the finest judges `` not only in Pennsylvania but in the United States . ''",2.442807083838142,0.3671196026725045,0.7571124459301233,0.5436712075405638,0.6328803973274957
936,"Clearly , the judge has had his share of accomplishments .",1.4099795458479036,0.27403532930912217,0.6563808586606824,0.8120513159389865,0.7259646706908778
937,"After practicing law locally , he was elected to his first 10-year term as judge in 1971 ; in 1981 , he was effectively re-elected .",2.1263158659670873,0.3268573539562291,0.6781347280486335,0.6682235252589233,0.6731426460437708
938,"Six years ago , Judge O'Kicki was voted president of the Pennsylvania Conference of State Trial Judges by the state 's 400 judges .",1.7983858107804247,0.2750579975643696,0.7940203046622482,0.6669210968967738,0.7249420024356307
939,He has been considered several times for appointments to federal district and appellate court vacancies in Pennsylvania .,1.9510786377090974,0.3460446315136515,0.6389071254964173,0.6697295757077233,0.6539553684863486
940,"And when he ran unsuccessfully for a state appellate court seat in 1983 , the Pennsylvania Bar Association rated him `` one of the best available , '' after interviewing local lawyers .",2.485250559646815,0.34327133083276395,0.6862105707564163,0.6296756949592969,0.6567286691672362
941,"`` He probably was the smartest guy who ever sat on our bench , '' says a former president of Cambria County 's 150-member bar association , who , like most lawyers in Cambria County , refuses to talk about the judge publicly .",3.4695730760249472,0.518798811415981,0.49794212475845834,0.4655493068792897,0.48120118858401867
942,`` He 's sharp as a tack .,0.75,0.14285714285714285,0.818181818181818,0.9,0.8571428571428571
943,He could grasp an issue with the blink of an eye . '',1.1930596157174573,0.21333454424511888,0.8265692515053586,0.7504370493782306,0.7866654557548811
944,"For more than a decade , virtually no one complained about Judge O'Kicki .",1.7682062501545346,0.30243823881012527,0.7040550481376402,0.6911871509690936,0.6975617611898747
945,"`` What about those institutions that are supposed to be the bedrock of society , the banks and the bar association ... ? '' wrote a columnist for the Tribune-Democrat , a newspaper in nearby Johnstown , shortly after the scandal became public .",3.1836578181198694,0.4844916179207634,0.5259840938279507,0.5054417989753955,0.5155083820792367
946,"`` If only a banker or a lawyer had spoken out years ago , the judicial process would n't be under the taint it is today . ''",2.250698214594782,0.3412317503539134,0.6587682496460868,0.6587682496460866,0.6587682496460867
947,"Officials with the Pennsylvania Judicial Inquiry and Review Board , the arm of the state that investigates judicial misconduct , counter that they had no inkling of anything amiss in Ebensburg .",2.854945201134101,0.4410629738184059,0.5753251066273748,0.54345671384565,0.558937026181594
948,"`` Nobody told us ; nobody called us , '' says an official close to the case who asked not to be named .",2.493686309665179,0.38307991678191183,0.6767379261903113,0.5668182033477976,0.6169200832180878
949,`` Nobody had the guts to complain . '',0.7505430557959416,0.13428195354110564,1.0000000000000002,0.7632300273809491,0.8657180464588946
950,Certainly not the lawyers .,0.7999999999999998,0.20812433153147833,0.6554587535412856,1.0,0.7918756684685216
951,"Johnstown attorney Richard J. Green Jr. shelled out $ 500 in loans to the judge over five years , he said in testimony to the grand jury .",2.4604947496278964,0.3582287922984803,0.7348711016658113,0.5696082554946291,0.6417712077015197
952,"`` The judge never made a pretense of repaying the money , '' said Mr. Green .",2.1776205887443454,0.3630998514668563,0.7179507881581509,0.5722930494456023,0.6369001485331437
953,"Eventually , Mr. Green testified , he began ducking out of his office rather than face the judge when he visited .",2.4831450219586673,0.40894458978213855,0.6267583492728078,0.5592008465461134,0.5910554102178615
954,"When Mr. Green won a $ 240,000 verdict in a land condemnation case against the state in June 1983 , he says Judge O'Kicki unexpectedly awarded him an additional $ 100,000 .",2.7968736214489858,0.417249125780853,0.5867664100711575,0.5787899254386951,0.5827508742191471
955,"Mr. Green thought little of it , he told the grand jury , until the judge walked up to him after the courtroom had cleared and suggested a kickback .",2.620973016103023,0.3784174800509633,0.6325715918987009,0.6109687341506201,0.6215825199490368
956,`` Do n't you think I ought to get a commission ... or part of your fee in this case ? '' Mr. Green said the judge asked him .,2.798277896735806,0.42298790767290206,0.601248011489534,0.5546543342136147,0.5770120923270982
957,"Appalled , Mr. Green never paid the money , he testified .",1.0629072918469546,0.17404686581748618,0.8832616547954522,0.7756281786893547,0.8259531341825136
958,"But he did n't complain to the state 's Judicial Inquiry and Review Board , either , saying later that he feared retribution .",2.3443609377704346,0.3434677216272823,0.6515797566787238,0.6615606628507164,0.6565322783727179
959,Mr. O'Kicki said he will respond to Mr. Green 's allegation at his trial .,1.0666666666666664,0.17166144636286237,0.9061106893898977,0.7628615915472957,0.8283385536371377
960,"Like most of Cambria County 's lawyers and residents who had dealings with the judge , Mr. Green declined to be interviewed for this article .",2.4707242675972108,0.3730823893555011,0.6437041642792518,0.6109843267841414,0.6269176106444987
961,And no one with a complaint about the judge would allow his name to be printed .,1.8535161767251154,0.3045483134185327,0.7091600353513603,0.6822632632367968,0.6954516865814674
962,"`` I do n't have anything much to say , and I think that 's what you 're going to find from everyone else you talk to up here , '' says local attorney Edward F. Peduzzi .",3.027251643148876,0.43856961797173327,0.6159153384504304,0.515801658215276,0.5614303820282666
963,Says another lawyer : `` The practice of law is a matter of biting one 's lip when you live in a small community .,2.3411730005192313,0.3533025107989109,0.7063938945692684,0.5963045845146779,0.6466974892010892
964,One had best not dance on top of a coffin until the lid is sealed tightly shut . '',1.4876138161310735,0.23329035703715653,0.8119802778280254,0.7262204095537603,0.7667096429628435
965,"The judge was considered imperious , abrasive and ambitious , those who practiced before him say .",1.6049536773614292,0.27369187249035903,0.71734851406635,0.7354943810738678,0.7263081275096411
966,"He sipped tea sweetened with honey from his high-backed leather chair at his bench , while scribbling notes ordering spectators to stop whispering or to take off their hats in his courtroom .",3.3131034814341924,0.595500249892089,0.40179479941353996,0.4072413680253766,0.4044997501079107
967,"Four years ago , he jailed all nine members of the Cambria County School Board for several hours after they defied his order to extend the school year by several weeks to make up for time lost during a teachers ' strike .",3.059623912610124,0.47395842616609885,0.5160460669161354,0.5364319431090704,0.5260415738339013
968,"Visitors in his chambers say he could cite precisely the years , months , weeks and days remaining until mandatory retirement would force aside the presiding president judge , giving Judge O'Kicki the seniority required to take over as the county 's top court administrator .",3.653906950167343,0.5411832410293844,0.47746744968687743,0.4415683482190051,0.4588167589706157
969,"The judge , they say , was fiercely proud of his abilities and accomplishments .",1.833985000288462,0.3066969076756562,0.6895345461608373,0.6971130576896962,0.6933030923243438
970,"`` My name is judge , '' Judge O'Kicki told a car salesman in Ebensburg when he bought a new red Pontiac Sunbird in October 1984 , according to the grand-jury report .",2.791307089044082,0.4171471619294242,0.6219297504474266,0.5483961668101566,0.5828528380705755
971,The dealership dutifully recorded the sale under the name `` Judge O'Kicki . '',1.3046187504636002,0.21655663184027937,0.892003701342298,0.698440439669005,0.7834433681597206
972,"Yet , despite the judge 's imperial bearing , no one ever had reason to suspect possible wrongdoing , says John Bognato , president of Cambria County 's 150-member bar association .",2.9883016532950095,0.47137680039522467,0.5578056779318574,0.5023423711056496,0.5286231996047753
973,"`` The arrogance of a judge , his demeanor , the way he handles people are not a basis for filing a complaint , '' says Mr. Bognato .",2.326236409277925,0.38272852573701416,0.6625341529542461,0.5777977733990084,0.6172714742629861
974,"`` Until this came up and hit the press , there was never any indication that he was doing anything wrong . ''",2.570409368641904,0.4078201365923401,0.5957990366986425,0.5886043938783977,0.5921798634076598
975,"State investigators dispute that view now , particularly in light of the judge 's various business dealings in Cambria County .",2.019351045550796,0.34044611911873623,0.6865423958727064,0.6346069871576685,0.6595538808812638
976,"The judge came under scrutiny in late 1987 , after the state attorney general 's office launched an unrelated investigation into corruption in Cambria County .",2.2259347300356627,0.3560431549797025,0.6756966706455504,0.6150650956139899,0.6439568450202975
977,The inquiry soon focused on the judge .,0.5,0.09090909090909091,1.0,0.8333333333333333,0.9090909090909091
978,"Even his routine business transactions caused trouble , according to the grand jury report .",2.2909685317733515,0.43586470674931677,0.5424936256854789,0.587575405720244,0.564135293250683
979,"When the judge bought his new Sunbird from James E. Black Pontiac-Cadillac in Ebensburg five years ago , the dealership had `` certain apprehensions '' about the judge 's reputation , according to the grand-jury report .",2.9159544705927227,0.43486719400044777,0.5917540679918747,0.5408036522324463,0.5651328059995523
980,"The dealership took the extra step of having all the paper work for the transaction pre-approved by Ebensburg 's local lender , Laurel Bank .",2.3597487383876388,0.3850787760124912,0.6411388638905245,0.5907635464529633,0.6149212239875089
981,"Then , as an additional precaution , the car dealership took the judge 's photograph as he stood next to his new car with sales papers in hand -- proof that he had received the loan documents .",3.1460230268851226,0.49137695015226557,0.5327531528337393,0.48658409204891273,0.5086230498477343
982,"But when the judge received his payment book , he disavowed the deal .",1.4285714285714288,0.23093104819347193,0.8927699291233712,0.6754759327050973,0.7690689518065281
983,"`` There was no loan , there is no loan , there never shall be a loan , '' the judge wrote the bank on his judicial stationery , according to the report .",2.2401362340355004,0.3745599935274561,0.6586114252948846,0.5954497680915636,0.6254400064725439
984,"Later , the judge went a step farther .",1.3333333333333348,0.26631956334878926,0.8051567697685735,0.6738597578300081,0.7336804366512109
985,"After Laurel Bank tried to repossess the car , a vice president asked him to intervene in an unrelated legal dispute involving a trust account .",1.8993876148174662,0.29834092092396663,0.7342392980395557,0.6718473620720319,0.7016590790760331
986,The judge wrote again .,0.0,0.0,1.0,1.0,1.0
987,"`` I find myself in an adversary relationship with Laurel Bank , and I am not inclined to extend myself as far as any favors are concerned , '' the judge wrote back in a letter attached to the grand jury 's report .",3.261664189879826,0.4645692426794541,0.5429308575684183,0.5281350478429572,0.5354307573205457
988,"`` Perhaps if my personal matters can be resolved with Laurel bank in the near future , I may be inclined to reconsider your request ... . ''",1.7367568029675242,0.26206277688447965,0.7323726524132691,0.7435870004847847,0.7379372231155203
989,The judge now says it was `` unfortunate '' that he chose to write the letter but says `` there was certainly no intent to extort there . '',2.4360414797963523,0.3696423975121771,0.6836439754281247,0.5847773514284276,0.630357602487823
990,The bank acquiesced .,0.0,0.0,1.0,1.0,1.0
991,"It refinanced the judge 's loan , lowered its interest rate and accepted a trade-in that had n't originally been part of the deal -- a beat up 1981 Chevy Citation the dealer had to repair before it could be resold .",3.1013057949650236,0.4504126113131944,0.5482356275544251,0.550945832254969,0.5495873886868056
992,The incident was n't the only time the judge got special treatment from his local bank .,2.46319429299572,0.4497804267116296,0.5523824096695765,0.54807360788837,0.5502195732883706
993,"Two years later , he wrote to complain that the interest he was paying on an unsecured $ 10,000 loan was `` absolutely onerous . ''",2.4126559982000204,0.35301767781608845,0.628521191260072,0.6665607639338332,0.6469823221839114
994,"Paul L. Kane , Laurel 's president at the time , quickly responded .",1.0539205358688184,0.17596544642738826,0.8962334867511544,0.7626008237161513,0.8240345535726118
995,"The bank , he wrote back , was `` immediately '' lowering the rate by 3.5 % , `` as a concession to you . ''",2.331891941657334,0.3529186422748826,0.7130794780950217,0.5922650551893877,0.6470813577251177
996,"The judge says he ca n't discuss in detail how he will defend himself at his trial , although he contends that if he were as corrupt as state prosecutors believe , he would be far wealthier than he is .",3.2441397778218164,0.5293077306506841,0.4543100702557201,0.4883001335115908,0.47069226934931585
997,His seven-bedroom cedar and brick house outside of Johnstown is up for sale to pay for his lawyers .,1.8536463657301878,0.29795850753737113,0.7266309641115718,0.6790617803122057,0.7020414924626284
998,The judge says he is confident he will return to his old bench .,1.5013964291895636,0.27091801284022043,0.7107602111065712,0.7483733439316499,0.7290819871597797
999,"Already , he notes , the 76 charges originally filed against him have been trimmed to 27 .",1.773119275605203,0.300525427756297,0.6686454595273451,0.7332839603814424,0.6994745722437032
1000,Most of the allegations no longer pending were ethics charges withdrawn by state prosecutors as part of a pre-trial agreement .,2.6033825934789085,0.48038672519141123,0.5492545322006074,0.4930074657842224,0.5196132748085887
1001,The heart of the case -- `` official oppression '' -- remains intact .,1.9371011056259833,0.34118256379558703,0.7949238849505242,0.5625055348963531,0.6588174362044129
1002,"`` If I lose , I lose my position , my career , my pension , my home and my investments , '' says the judge .",1.760419735857655,0.3424594901378657,0.7078379187238389,0.6139169209535464,0.6575405098621344
1003,`` My God and I know I am correct and innocent .,1.125814583693911,0.20935869082172,0.8428897893328974,0.744492230136365,0.7906413091782797
1004,"Many thanks for Alexander Cockburn 's comic masterpiece -LRB- `` U.S. . Economy : A House Built on Junk-Bond Sand , '' Viewpoint , Oct. 19 -RRB- .",2.8766191944280126,0.4664791353769667,0.6188850646904791,0.4688511743486787,0.5335208646230335
1005,The use of the abominable construction practices in the Soviet Union -- as evidenced by the collapse of sand apartment blocks during the Armenian earthquake -- as a metaphor for the U.S. economic system was a sublime example of Mr. Cockburn 's satirical muse .,3.04192839631734,0.4739015321481909,0.6023636217449233,0.4669748614649049,0.5260984678518088
1006,I await his sequel : the economic and social resiliency of the San Francisco Bay area and the outstanding work of the local governments and the private charitable organizations there as metaphors for the supremacy of whatever failed system Mr. Cockburn now believes in .,3.0387146520527093,0.47316396506320946,0.5311393267097017,0.5226019133025414,0.5268360349367909
1007,It should be a scream .,0.0,0.0,1.0,1.0,1.0
1008,William S. Smith,1.584962500721156,1.0,1.0,0.0,0.0
1009,"As a money manager and a grass-roots environmentalist , I was very disappointed to read in the premiere issue of Garbage that The Wall Street Journal uses 220,000 metric tons of newsprint each year , but that only 1.4 % of it comes from recycled paper .",2.9640282404473215,0.41985620332343665,0.574326164585353,0.586080494151015,0.5801437966765632
1010,"By contrast , the Los Angeles Times , for example , uses 83 % recycled paper .",1.824679412273758,0.2873399447244672,0.7696989911769393,0.6634916672278152,0.7126600552755329
1011,"With newspapers being the largest single component of solid waste in our landfills , and with our country overflowing with trash , all sectors of our society and all types of businesses must become more responsible in our use and disposal of precious natural resources .",3.043299088318082,0.5009601649022547,0.4917410419757786,0.5065585610648071,0.49903983509774547
