id,sentence,VI,normalized-VI,homogeneity,completeness,V-score
1447,"As a result , he said he will examine the Marcos documents sought by the prosecutors to determine whether turning over the filings is self-incrimination .",2.499758402295807,0.42225821003641806,0.5675830463197213,0.5882708083583865,0.577741789963582
1448,Judge Keenan also directed the prosecutors to show that Mrs. Marcos 's Fifth Amendment right against self-incrimination wo n't be violated .,1.6604238642264004,0.2542308218854601,0.807714465944143,0.6926485338714459,0.7457691781145398
1449,"Mrs. Marcos 's attorney in New York , Sandor Frankel , declined to comment on the ruling .",2.1677527782585475,0.3643358519939894,0.7274246505097243,0.5644606338431143,0.6356641480060105
1450,Mrs. Marcos has n't admitted that she filed any documents such as those sought by the government .,1.486382639009081,0.21688038478796404,0.8010074413638064,0.7660132670761457,0.7831196152120359
1451,"Charles LaBella , the assistant U.S. attorney prosecuting the Marcos case , did n't return phone calls seeking comment .",2.2264662506490396,0.3700053134619594,0.7372610925805726,0.5499768470230413,0.6299946865380405
1452,U.S. . AND BRITISH LAW FIRMS announce rare joint venture in Tokyo .,1.5007519234097648,0.25435923548017325,0.8265692515053584,0.67914629698796,0.7456407645198266
1453,"Sidley & Austin , a leading Chicago-based law firm , and Ashurst Morris Crisp , a midsized London firm of solicitors , are scheduled today to announce plans to open a joint office in Tokyo .",2.8335053698067822,0.43091746747275733,0.6030374689491091,0.5387475378745141,0.5690825325272427
1454,The firms will be registered under Japanese law as foreign legal consultants and their practice with Japanese clients will be limited to advising them on matters of foreign law .,2.9208550968480114,0.4985295209400594,0.514365212140049,0.489206456287773,0.5014704790599409
1455,The office may also be able to advise foreign and multinational clients on international law and general matters .,2.2694429199349324,0.3909220315403476,0.5882772228219049,0.6314036090894637,0.6090779684596521
1456,"The office will provide `` one-stop shopping '' for Japanese financial institutions and other clients seeking advice on access to the world capital markets , according to A. Bruce Schimberg , Sidley 's senior banking specialist , who will move to Tokyo from Chicago to open the office next year .",3.2585686819691797,0.4832829031553306,0.5641221012994151,0.47666167485718997,0.5167170968446694
1457,"The Sidley-Ashurst venture will also be staffed by another Sidley partner specializing in corporate law , a partner from Ashurst concentrating on acquisitions and a Japanese attorney .",2.1114076956701355,0.32292825536575753,0.7076070709720803,0.649062776782129,0.6770717446342427
1458,"The office will tap the resources of Sidley 's 700 lawyers in the U.S. , London and Singapore as well as the 400 Ashurst staff members in London and Brussels .",2.2618025129391413,0.3338457973474857,0.7115050059863419,0.6262382399784179,0.6661542026525143
1459,Ashurst is new to the Far East .,1.0943609377704333,0.22308223737786706,0.7921550211540895,0.7622556248918265,0.7769177626221329
1460,Sidley will maintain its association with the Hashidate Law Office in Tokyo .,1.2007415749566785,0.20377643951522267,0.8840447819029705,0.7242740063643948,0.7962235604847772
1461,THE UNITED AUTO WORKERS said it will seek a rehearing of a U.S. appellate court ruling against the union 's claim that the state of Michigan engages in wage-discrimination against female employees .,2.3869969676717266,0.369071261155371,0.6674145432686364,0.5982253275642834,0.630928738844629
1462,A three-judge panel of the court in Cincinnati made the ruling Saturday .,1.4049740389608,0.24699743431243662,0.8047491340837818,0.7075087019646573,0.7530025656875632
1463,The UAW is seeking a hearing by the full 14-judge panel .,1.459147917027245,0.25550776986363494,0.7444922301363649,0.7444922301363649,0.7444922301363648
1464,"The union sued the state in November 1985 , alleging that it intentionally segregated job classifications by sex and paid employees in predominantly female jobs less than males in comparable jobs .",2.559793843694842,0.39272533838511103,0.6263883193281539,0.5892929350936994,0.6072746616148886
1465,The UAW also charged that the state applied its own standards for determining pay in a discriminatory manner .,2.2694429199349333,0.3772416895395035,0.6011942164460364,0.64592691097891,0.6227583104604963
1466,"In November 1987 , a district court judge in Detroit ruled against the UAW .",1.8843108337660257,0.3327522790225903,0.7025188946914406,0.6353489312203868,0.6672477209774095
1467,"The union is the bargaining representative for more than 20,000 Michigan state employees .",1.7403234269000198,0.31140195487414213,0.7146739768314831,0.6643579670773981,0.6885980451258579
1468,NEW JERSEY MERGER :,1.0,0.3333333333333333,0.6666666666666666,0.6666666666666666,0.6666666666666666
1469,"One of the largest law firms in central New Jersey has been created through the merger of Norris , McLaughlin & Marcus , a 41-lawyer firm , and Manger , Kalison , McBride & Webb , a health-care specialty law firm with 14 lawyers .",3.4491917320973946,0.5054943340517881,0.5529325453362751,0.4472463586853893,0.494505665948212
1470,"Norris McLaughlin is a general-practice firm that has expanded recently into such specialties as banking , labor and environmental work .",2.2251931406285994,0.36015165260436854,0.6115673982517118,0.670871729818104,0.6398483473956316
1471,The merged firm will carry Norris McLaughlin 's name .,0.8000000000000007,0.13689590811625363,0.926522673256629,0.8078110764361959,0.8631040918837465
1472,DRUG WARS :,0.666666666666667,0.26631956334878915,1.0,0.5793801642856952,0.7336804366512111
1473,A Texas legislator proposes color-coding drivers ' licenses of some drug offenders .,2.0861088829818266,0.3925115603883216,0.6458103109612816,0.5734597907173465,0.6074884396116783
1474,The bill would authorize courts to order the licenses as a condition of probation .,1.6746276985842492,0.2987301859490126,0.7710471977585385,0.6430736409416831,0.7012698140509872
1475,"State Senator J.E. `` Buster '' Brown , a Republican who is running for Texas attorney general , introduced the bill .",2.683434656348063,0.457004362049185,0.6037362320787039,0.4933597795473343,0.5429956379508147
1476,He said an altered license would be an `` embarrassment '' to teenagers and young adults and would act as a deterrant to drug use .,2.279168498699284,0.35030036703250134,0.6962496790905235,0.6089840176351763,0.6496996329674986
1477,"Richard Avena , executive director of the Texas Civil Liberties Union , called the proposal `` political gimmickry , '' and said it fails to recognize the drug problem as a health issue .",2.651146043747578,0.405485737085506,0.6611017093404186,0.5401130308532894,0.594514262914494
1478,"The amendment , offered by Rep. Douglas Bosco -LRB- D. , Calif. -RRB- , was approved 283-132 during debate on a bill designed to strengthen the Transportation Department 's authority in dealing with leveraged buy-outs of airlines .",2.628692510840281,0.3842931035722099,0.6852531847728278,0.558976425779583,0.6157068964277902
1479,"The bill would require the agency to block the acquisition of 15 % or more of an airline 's stock if the purchase threatened safety , reduced the carrier 's ability to compete , or put the airline under foreign control .",3.363024574422558,0.5387039927559127,0.45900752860961563,0.4636074196031784,0.461296007244087
1480,"Debate on the legislation , which faces a veto threat from President Bush , is to continue today .",1.532600814671775,0.23426377126745132,0.8880413354186065,0.6730418347646503,0.7657362287325485
1481,The amendment would require the department to block the purchase of a major airline by anyone who has run two or more carriers that have filed for protection from creditors under Chapter 11 of the Bankruptcy Code .,3.2956656152599235,0.5078733447596468,0.48621827017074176,0.4981804006917248,0.49212665524035304
1482,"In 1983 , Texas Air 's Continental Airlines filed for bankruptcy .",1.0629072918469564,0.19537476230114084,0.8467132018086355,0.7665233095909046,0.8046252376988594
1483,"Earlier this year , Texas Air 's Eastern Airlines filed for bankruptcy .",1.134991346320266,0.2008655248911552,0.8129136273233449,0.785814659277702,0.7991344751088447
1484,"`` This ought to be subtitled the ` Do n't let Frank Lorenzo take over another airline ' amendment , '' said Rep. James Oberstar -LRB- D. , Minn. -RRB- , chairman of the House aviation subcommittee , who argued that the provision was unnecessary because the bill already would give the department ample power to block undesirable deals .",3.5231484442499554,0.4928529925419126,0.5545553300812704,0.46720607607637277,0.5071470074580874
1485,"For years , a strict regimen governed the staff meetings at Nissan Motor Co. 's technical center in Tokyo 's western suburbs .",1.5225891308110393,0.24394598510242327,0.8345971289827112,0.6910225619554552,0.7560540148975768
1486,Employees wore identification badges listing not only their names but also their dates of hire .,1.8609023444260844,0.3453087072009843,0.7103390651656863,0.6071289715592829,0.6546912927990157
1487,"No one could voice an opinion until everybody with more seniority had spoken first , so younger employees -- often the most enthusiastic and innovative -- seldom spoke up at all .",3.2810537018653423,0.507200639895781,0.48632720510802724,0.4994461044489442,0.4927993601042191
1488,"But in 1986 , the badges and the `` do n't speak out of turn '' rule were abolished -- early steps in a cultural revolution still rolling on with all the subtlety of a freight train .",3.30917384110143,0.49982729805192544,0.5241522550373321,0.4782912535768252,0.5001727019480743
1489,"In recent years , Nissan has instituted flex-time work schedules and allowed employees to dress casually , even in blue jeans .",1.9154075221553466,0.28078412445764467,0.7909424730566068,0.6594166902107778,0.7192158755423552
1490,"A rule forbidding staffers to own competitors ' cars has been lifted , and now many designers drive foreign cars to get useful ideas .",3.0920089978459098,0.5565468106214504,0.4295740788594049,0.4582590838304981,0.4434531893785495
1491,Nissan 's decades-old corporate song filled with references to Mount Fuji has been scrapped in favor of a snappy tune sung by a popular Japanese vocalist .,2.178848941604091,0.34118511467573126,0.7095931535345121,0.6148186513901559,0.6588148853242689
1492,"And in a Japanese corporate first , Nissan recently opened the first coed company dormitory for single employees at the suburban Tokyo technical center .",2.6210314974132176,0.44676564995961104,0.5688093959717249,0.5384895180516875,0.5532343500403891
1493,"`` We had lots of internal debate about this one , '' concedes Tadahiko Fukuyama , a senior public-relations official .",1.8675848070892194,0.29768344754178194,0.7838864719209846,0.6361226862025318,0.7023165524582179
1494,"`` But in the end , top management decided to follow the voice of the younger generation . ''",2.0794618423329965,0.3468463257355831,0.6894697584322198,0.6204718796952049,0.6531536742644168
1495,"This corporate glasnost is a big reason Nissan , after years of making lackluster cars and lousy profits , has loosened up its rigid ways and now is riding a string of hits , ranging from the sleek Maxima sedan and Porsche-like 300ZX to the whimsically nostalgic Pao , a minicar sold only in Japan .",3.5379441550772324,0.5216976211500457,0.47445597182212207,0.4822116611278055,0.4783023788499546
1496,The company 's turnaround is far from complete ; many crucial tests are just beginning .,2.110902344426084,0.3743333549720639,0.5820876783248854,0.6762988916424147,0.625666645027936
1497,But its surprising progress so far holds important lessons for companies in trouble .,1.8760473218921723,0.34404275275008134,0.6370589066798417,0.676011104026894,0.6559572472499187
1498,The big one : A company 's culture ca n't be radically changed unless top management first admits that things have gone badly awry and then publicly leads the charge .,2.5653479817848526,0.3964103049060257,0.6238438813091947,0.5846093275095643,0.6035896950939742
1499,"Atsushi Muramatsu , Nissan 's executive vice president for finance , helped set the tone in December 1986 , when the company was heading toward the first operating loss by a Japanese auto maker since the nation 's postwar recovery .",3.141144204004159,0.4887311408927574,0.5350043347207535,0.48954996721366617,0.5112688591072428
1500,"`` This is a time of self-criticism to discover what is wrong with us , '' he said .",2.0191856829789616,0.34544986407298195,0.6895402269760688,0.6229396314629925,0.6545501359270179
1501,"Yutaka Kume , who took the helm as Nissan 's president in June 1985 , added simply , `` I am deeply disappointed . ''",2.2007820003461553,0.3252260444572898,0.7149644130982404,0.6388614890094044,0.6747739555427104
1502,No wonder .,4.440892098500626e-16,1.4009454786722165e-16,1.0,1.0,1.0
1503,"Nissan , Japan 's second-largest auto maker and the world 's fourth-largest , was getting beat up not only by its bigger rival , Toyota Motor Corp. , but also by Honda Motor Co. , the most successful Japanese car company in the U.S. but a relative pipsqueak in Japan .",3.294377813104801,0.47482157374230954,0.5641854868912504,0.4912163575939875,0.5251784262576902
1504,Nissan 's market share in Japan had been dropping year by year since the beginning of the decade .,1.4478828949645761,0.23330872633637112,0.8828144403161573,0.677565969018379,0.7666912736636287
1505,"Its U.S. sales sagged , partly because of price increases due to the rising yen .",1.5943609377704338,0.26997263479365297,0.7300273652063471,0.7300273652063471,0.7300273652063473
1506,"Worst of all , Nissan was preoccupied with management infighting , cronyism and corporate rigidity .",0.9693609377704338,0.15434113123932963,0.8628313113822164,0.8291566341564167,0.8456588687606704
1507,"Consider the experience of Satoko Kitada , a 30-year-old designer of vehicle interiors who joined Nissan in 1982 .",2.158923684665993,0.3523964993093916,0.6589250724181556,0.6366644090172368,0.6476035006906082
1508,"At that time , tasks were assigned strictly on the basis of seniority .",1.822126786023353,0.33088255074519535,0.7057331852115044,0.636113794036475,0.6691174492548047
1509,"`` The oldest designer got to work on the dashboard , '' she recalls .",1.7836591668108976,0.2957915543983634,0.7610426460556,0.6552730537642182,0.7042084456016365
1510,`` The next level down did doors .,1.701205059304601,0.4478275573867071,0.4195179762781592,0.8075138790838329,0.5521724426132925
1511,"If a new person got to work on part of the speedometer , that was a big deal . ''",2.22646625064904,0.37000531346195953,0.6299946865380402,0.6299946865380404,0.6299946865380402
1512,"This system produced boring , boxy cars that consumers just were n't buying .",2.1617616076064574,0.3964390479874653,0.5414652233583229,0.6817439768326297,0.6035609520125346
1513,"Desperately hoping to spark sales , Nissan transferred 5,000 middle managers and plant workers to dealerships .",1.4776126752213994,0.2286611507112904,0.828746347554415,0.721369384210294,0.77133884928871
1514,"Meanwhile , President Kume ordered everyone from top executives to rookie designers to go `` town watching , '' to visit chic parts of Tokyo to try to gain insights into developing cars for trend-setters .",3.1188314159676453,0.4840470049705177,0.555541074162416,0.48163172563274564,0.5159529950294822
1515,Some town-watching excursions were downright comic .,1.4285714285714293,0.3412623489149146,0.5467803277018796,0.8283480523167006,0.6587376510850855
1516,One group of middle-aged manufacturing men from the company 's Zama plant outside Tokyo was supposed to check out a trendy restaurant in the city .,2.6676248629342783,0.42534209383476795,0.588739207980017,0.5612344554274333,0.5746579061652317
1517,"But when they arrived at the door , all were afraid to go in , fearing that they would be out of place .",2.1247382691537906,0.32462607348879663,0.6555312450872195,0.6964553654922675,0.6753739265112032
1518,Other trips were more productive .,1.125814583693911,0.2783837401553244,0.6480409554829325,0.81403803623258,0.7216162598446755
1519,Mr. Kume himself visited Honda 's headquarters in Tokyo 's upscale Aoyama district .,0.9721171767454884,0.1712194731129292,0.8738533395785805,0.7881293065920894,0.8287805268870712
1520,He liked the well-lighted lobby display of Honda 's cars and trucks so much that he had Nissan 's gloomy lobby exhibit refurbished .,1.8239348962840571,0.2664238288790068,0.7554382630190098,0.7129438511100828,0.7335761711209932
1521,"Later , Nissan borrowed other Honda practices , including an engineering `` idea contest '' to promote inventiveness .",1.827845050168448,0.2925976518137329,0.8274438444271466,0.6177781263901598,0.7074023481862669
1522,One engineer developed a `` crab car '' that moves sideways .,1.1258145836939102,0.1971385972613608,0.8730552662007037,0.7431147865896833,0.8028614027386389
1523,"Such sudden cultural shifts may come across as a bit forced , but they seem to be genuine -- so much so , in fact , that some older employees have resisted .",2.568731999106312,0.3876851096980069,0.6094729864607188,0.6151834212570912,0.6123148903019929
1524,"Nissan handled the die-hards in a typically Japanese fashion : They were n't fired but instead `` were neglected , '' says Kouji Hori , the personnel manager at the Nissan Technical Center .",2.8024768386807146,0.4231967016856124,0.5736310834628502,0.5800107933504149,0.5768032983143875
1525,"Despite the pain of adjusting , the cultural revolution has begun to yield exciting cars .",1.7193609377704338,0.28510426839154507,0.7497874999059361,0.6831069776105934,0.7148957316084549
1526,"A year ago , the company completely revamped its near-luxury sedan , the $ 17,699 Maxima , which competes against a broad range of upscale sedans ; it replaced its boxy , pug-nosed body with sleek , aerodynamic lines .",3.3860483599056024,0.5443752116891766,0.44910908971916785,0.4623323303822434,0.4556247883108235
1527,"Since then , Nissan also has launched new versions of the $ 13,249 240SX sporty coupe and 300ZX sports car .",1.9814114511636571,0.29963514256068713,0.6885133289864162,0.7126315378235258,0.7003648574393126
1528,"The restyled 300ZX costs as much as $ 33,000 and is squared off against the Porche 944 , which begins at $ 41,900 .",2.375814583693912,0.3584812897591368,0.6181990462254374,0.6666666666666669,0.6415187102408633
1529,"Besides new styling , the new Nissans have more powerful engines and more sophisticated suspension systems .",1.9482009105155162,0.33845634100185057,0.6540614497052478,0.6691990364115346,0.6615436589981497
1530,All three new models are outselling their predecessors by wide margins .,1.7295739585136225,0.3179158743371357,0.6139492543879493,0.7672297640677026,0.6820841256628644
1531,"In its home market , Nissan has grabbed attention with limited-production minicars featuring styling odd enough to be cute .",1.9887218755408664,0.3080837328443572,0.7240833952350869,0.6624855976887342,0.6919162671556427
1532,"One is the Pao , a tiny coupe with a peelback canvas top and tilted headlights that give it a droopy-eyed look .",2.4336594978711785,0.3995025029017472,0.5972794554092586,0.6037504031701977,0.6004974970982528
1533,"Nissan initially planned to sell just 10,000 Paos , but sales have passed 50,000 , and there 's a one-year waiting list for the car .",2.0682475965698988,0.28810549403110663,0.7264323732950678,0.697927105781092,0.7118945059688933
1534,"Then , there 's the S-Cargo , an offbeat delivery van with a snail-like body that inspired its name .",2.0509775004326922,0.32082221485791773,0.7215588872972735,0.6414990361682607,0.679177785142082
1535,Nissan helped develop a Tokyo restaurant with both vehicles as its design theme .,1.571428571428572,0.260029030674253,0.8391548936850567,0.661754846067997,0.7399709693257472
1536,"The chairs are S-Cargo seats , and a gift shop sells such items as alarm clocks styled like the Pao 's oversized speedometer .",1.8799756449484892,0.3246963883785906,0.6846657913186287,0.6661940165817066,0.6753036116214093
1537,All these vehicles have sharply improved Nissan 's morale and image -- but have n't done much for its market share .,1.5620239989363771,0.22932547042429305,0.7964782892601547,0.7464902483043105,0.770674529575707
1538,Nissan had 29 % of the Japanese car market in 1980 before beginning a depressing eight-year slide that continued through last year .,2.685845109165973,0.4222177949379065,0.5671040951724774,0.5888701521405918,0.5777822050620933
1539,"Strong sales so far this year are certain to turn the tide , but even the 25 % market share that Nissan expects in 1989 will leave it far below its position at the beginning of the decade .",2.701974431537267,0.3911913175674598,0.6077973604002066,0.6098233755782103,0.6088086824325404
1540,"Nissan concedes that it wo n't recoup all its market-share losses in Japan until at least 1995 , and even that timetable might prove optimistic .",1.9724697121209323,0.27114612348290956,0.7183902077981555,0.7396268664918767,0.72885387651709
1541,"`` Everyone else is going to catch up '' with Nissan 's innovative designs , says A. Rama Krishna , auto analyst at First Boston -LRB- Japan -RRB- Ltd .",2.8726936489128017,0.4304034316143406,0.6496399105775237,0.5071140969001665,0.5695965683856593
1542,"Nissan 's pace of new-model hits will slow , he adds , just as arch-rival Toyota unleashes its own batch of new cars .",2.042481250360579,0.316135539684155,0.6751560643096042,0.6928004395656274,0.6838644603158451
1543,"Likewise , in the U.S. , Nissan has grabbed 5.2 % of the car market so far this year , up from 4.5 % a year ago .",2.5835248724156195,0.399941532208123,0.6149861101239268,0.5858383334471502,0.6000584677918769
1544,"But even that brings Nissan only to the share it had in 1987 , and leaves the company behind its high of 5.5 % in 1980 and 1982 .",1.9701871693023199,0.2989541495284885,0.6959954454818792,0.706170086486955,0.7010458504715116
1545,Why ?,0.0,0.0,1.0,1.0,1.0
1546,"So far , Nissan 's new-model successes are mostly specialized vehicles with limited sales potential .",1.569963467422733,0.2540378942983384,0.8451973316905765,0.6675809470508461,0.7459621057016613
1547,"In compact and subcompact cars , the bread-and-butter sales generators for Japanese auto makers , Nissan still trails Toyota and Honda .",2.0082186121538195,0.32477726478860586,0.7296176697881088,0.6283756611949114,0.6752227352113941
1548,"Nissan hopes that that will start to change this fall , with its new version of the Stanza compact sedan .",1.822126786023352,0.2768535092627203,0.7065571473596365,0.740533570798035,0.7231464907372797
1549,The Stanza has been a nonentity compared with Honda 's hugely successful Accord and Toyota 's Camry .,1.5066341932646505,0.2278982989995153,0.7996523335358103,0.7463862585798691,0.7721017010004844
1550,"But this year , Honda has revamped the Accord and made it a midsized car .",1.4221804688852169,0.21620849616775534,0.8375473301974595,0.7365198660327952,0.7837915038322448
1551,"Nissan instead has kept its new Stanza a bit smaller than that and cut the base price 6 % ; at $ 11,450 , Stanza prices start $ 749 below the predecessor model yet have a more-powerful engine .",3.0076980755422507,0.4418896898784398,0.5291425345203554,0.5904334410593485,0.5581103101215604
1552,"Accord prices start at $ 12,345 .",0.0,0.0,1.0,1.0,1.0
1553,Nissan 's risk is that its low-base-price strategy might get lost amid the highly publicized rebates being offered by Detroit 's Big Three .,1.907268229617391,0.26878112868716497,0.7323569990684811,0.7300842755091841,0.7312188713128351
1554,"But `` on a new car , a rebate does n't work well '' because it cheapens the vehicle 's image , contends Thomas D. Mignanelli , executive vice president of Nissan 's U.S. sales arm .",2.581005727667809,0.3782179210297112,0.6496195980436795,0.596232313464118,0.621782078970289
1555,"Even if the new Stanza succeeds , Nissan will remain behind in the subcompact segment , where its Sentra does n't measure up to the Honda Civic and Toyota Corolla .",2.392929337657548,0.3297227304833557,0.710280911810459,0.6345394524701102,0.6702772695166441
1556,Nissan will introduce a completely revamped Sentra next fall .,0.5999999999999996,0.10631029208133469,0.8631040918837466,0.926522673256629,0.8936897079186652
1557,"At the opposite end of the market , Nissan launches its luxury Infiniti division on Nov. 8 -- three years after Honda pioneered Japanese luxury cars and two months after Toyota 's Lexus went on sale .",2.9179553873804784,0.4424307403924809,0.5685500879876724,0.5470045560224674,0.557569259607519
1558,Nissan started advertising Infiniti fully eight months before the cars hit American showrooms .,1.1617616076064579,0.18003578597354553,0.8862281855502356,0.7629200851848285,0.8199642140264546
1559,"The ads featured fences , rocks and pussy-willow buds -- almost anything but the cars themselves .",1.7802742650876722,0.3179084593610302,0.7511721740155612,0.6246466709311019,0.6820915406389699
1560,The ads have generated some laughs but also plenty of attention because they are so unlike any other U.S. auto advertising .,2.1780066800406193,0.3320618900789021,0.6707885333486233,0.6651118089515581,0.6679381099210978
1561,"On the other hand , Nissan 's sales goals for Infiniti are modest compared with Toyota 's targets for Lexus .",1.881417857348901,0.29713845970640834,0.7757291797994232,0.642507954025666,0.7028615402935916
