id,sentence,VI,normalized-VI,homogeneity,completeness,V-score
457,"Here are price trends on the world 's major stock markets , as calculated by Morgan Stanley Capital International Perspective , Geneva .",2.0103839546751097,0.3203571745245792,0.7195235081486014,0.6439508709385912,0.6796428254754209
458,"To make them directly comparable , each index is based on the close of 1969 equaling 100 .",1.5485723878292896,0.24399134910304215,0.6931258289343165,0.8314398050243156,0.7560086508969576
459,The percentage change is since year-end .,1.3585392863324195,0.3191928678347274,0.6808071321652726,0.6808071321652727,0.6808071321652726
460,"French consumer prices rose 0.2 % in September from the previous month and were up 3.4 % from a year earlier , according to definitive figures from the National Statistics Institute .",2.6355842633636684,0.3866060301353074,0.6281345577430552,0.5993293606191322,0.6133939698646927
461,"The state agency 's figures confirm previous estimates and leave the index at 178.9 , up from 178.5 in August and 173.1 a year earlier .",2.8955466351978565,0.4451035363963576,0.5557661078195469,0.5540295367161143,0.5548964636036422
462,The index is based on 1980 equaling 100 .,0.44444444444444553,0.08153506054249816,0.9184649394575021,0.918464939457502,0.9184649394575021
463,A breakdown showed that food prices were the most active part of growth with a rise of 0.6 % .,2.288721875540866,0.397683485836342,0.5833843964223286,0.6225186244117374,0.6023165141636577
464,An official linked the gain essentially to higher prices for beef and pork .,1.8292600338883434,0.3326087274079355,0.6816412745058056,0.6537248749320983,0.6673912725920645
465,He said summer drought problems that had hit several southern agricultural regions had stopped being a major source of price pressure in September .,2.219213538701668,0.36654128795769353,0.6729740057097199,0.5983265254194112,0.6334587120423064
466,"Japan 's index of leading indicators rose to 63.6 in August , above the so-called boom-or-bust line of 50 for the first time since May , the Economic Planning Agency said .",2.540632029567119,0.40409674897427705,0.625604194926736,0.5688946286596489,0.5959032510257228
467,"The leading index recovered from July 's revised level of 36.6 on strong performances in consumer durables and machinery orders , among other factors , according to an agency spokeswoman .",3.487520449627571,0.595542383794874,0.4144211503121411,0.39496192184608625,0.40445761620512594
468,The index is intended to measure future economic performance .,0.9999999999999991,0.17718382013555775,0.8530453465132579,0.7946561378256197,0.822816179864442
469,A figure above 50 indicates the economy is likely to expand ; one below 50 indicates a contraction may be ahead .,1.8290377707967034,0.2906036066623499,0.7197930399843024,0.6992958074639019,0.70939639333765
470,"Metromedia Co. said its Metromedia Long Distance unit has been renamed Metromedia-ITT Long Distance , reflecting acquisitions from ITT Corp. , which licenses its name to closely held Metromedia .",2.2706226457093637,0.3565014255379933,0.7417016927320252,0.5682596119192297,0.6434985744620065
471,"Metromedia said its unit is the fifth-largest provider of long-distance communications service in the U.S. , with projected 1989 revenue of more than $ 550 million .",2.3475584438983033,0.39039148799578477,0.5908832429370278,0.629559441527613,0.6096085120042156
472,"Metromedia , headed by John W. Kluge , has interests in telecommunications , robotic painting , computer software , restaurants and entertainment .",2.071803671930577,0.3467761305640777,0.7890320043187897,0.5573012211762552,0.6532238694359226
473,"South Korean consumer prices rose 5 % in the first 10 months of this year , matching the government 's target for the entire year , according to the Bank of Korea and the Economic Planning Board .",3.0475384834953765,0.4470670083110132,0.5892720732058732,0.520815474431376,0.5529329916889867
474,"According to reports released by the two government agencies , domestic consumer and wholesale prices each rose by 0.2 % in October from the previous month .",3.1774240719192917,0.539652604608273,0.44087283434722685,0.4816219568249498,0.46034739539172703
475,"As a result , consumer prices for the first 10 months of 1989 surged by 5 % and wholesale prices by 1.3 % .",2.8533502449047363,0.505025957859419,0.4738602072276672,0.5180571651670611,0.49497404214058116
476,The South Korean government had been projecting a 5 % consumer price increase for the entire year .,1.8819057211626236,0.2914094081748281,0.792933269118736,0.6404655875275183,0.7085905918251718
477,Martin Marietta Corp. said it won a $ 38.2 million contract from the U.S. Postal Service to manufacture and install automated mail-sorting machines .,2.061830977306835,0.3200891452910898,0.683247167187856,0.6766069664909228,0.6799108547089103
478,"Under terms of the three-year contract , Martin Marietta said it will make and install 267 of the new machines at 156 postal offices .",2.105167619323627,0.3140848281709498,0.6958416203950639,0.6762679492169076,0.6859151718290503
479,"The new machines are capable of sorting by zip code up to 10,000 large flat mail pieces , including magazines and parcels , an hour .",2.689082575418986,0.456977410248668,0.5617608195168058,0.5254940820523378,0.5430225897513319
480,"Thomas A. Donovan , 37 years old , formerly vice president , West Coast operations , at this hazardous-waste-site remediation concern , was named executive vice president and chief operating officer , both newly created posts , and a director , filling a vacancy .",2.349394986953146,0.36118395909715345,0.7191843127481744,0.574604452792556,0.6388160409028464
481,"Canonie said it anticipates naming Mr. Donovan to succeed Richard F. Brissette , 55 , as president and chief executive officer , effective March 1 .",2.3044671908036003,0.34732645500832604,0.7235427257991719,0.5944487889380269,0.6526735449916736
482,Mr. Brissette will remain a Canonie board member and will be a consultant to the company .,1.6626272062641432,0.2648759043776984,0.8175194264483733,0.6678168394989927,0.7351240956223015
483,Yields on savings-type certificates of deposit dropped slightly in the week ended yesterday .,1.597466284042877,0.29333833179681973,0.7710258446985934,0.6522156068655508,0.7066616682031802
484,"The average yield on a six-month CD of $ 50,000 or less was 7.90 % , compared with 7.94 % a week earlier .",2.183484499746168,0.3455004176958784,0.6403769333690988,0.6692591904357497,0.6544995823041216
485,"The average one-year savings-type CD was down to 7.99 % from 8.01 % , according to Banxquote Money Markets , a New York information service that tracks CD yields .",2.766991029689816,0.4248114484635454,0.5678305229276281,0.5827397763700987,0.5751885515364545
486,"`` This week was uneventful for the CD market , '' said Norberto Mehl , chairman of Banxquote .",2.248897681747397,0.40048907169638764,0.6352343104807573,0.5675915416634109,0.5995109283036122
487,`` The major banks have n't even reacted to sharp rises in the three-month Treasury bill rates '' in the past two weeks .,2.1247382691537906,0.3165650592851955,0.722714215746207,0.6482052053859474,0.6834349407148045
488,"Banks that adjusted payouts on CDs in the most recent week made only fractional moves , he said .",2.0986475253119585,0.3511702040802819,0.6778098762093869,0.6222262209719069,0.6488297959197181
489,The CD trend runs counter to the direction of short-term interest rates at the Treasury bill auction Monday .,2.1803116823800277,0.36988974765844007,0.7121120927210577,0.5650437698379022,0.6301102523415595
490,"The average six-month bill was sold with a yield of 8.04 % , up from 7.90 % .",1.464695998700015,0.25786145488568896,0.6507167445962344,0.863447780512539,0.7421385451143109
491,The average three-month issue rose to 8.05 % from 7.77 % .,1.0629072918469564,0.18409515009462638,0.807110956580132,0.8248924821931783,0.8159048499053737
492,"Typically , banks offer CD yields higher than those on Treasury bills , which are considered the safest short-term investments ; banks need a competitive edge to sell their products .",2.926743740425824,0.45610519124064425,0.558699008285843,0.5298549094865881,0.5438948087593557
493,"But when market interest rates move up rapidly , increases in bank CD yields sometimes lag .",2.7068242606472666,0.5172795601457376,0.5674808522403396,0.4199896901022194,0.4827204398542625
494,"Most yields on short-term jumbo CDs , those with denominations over $ 90,000 , also moved in the opposite direction of Treasury bill yields .",2.4945811190640095,0.39895805922048505,0.616317159705197,0.5865055917994559,0.6010419407795148
495,"The average six-month yield on a jumbo CD was at 7.90 % , down from 7.93 % , Banxquote said .",1.5490154768086084,0.24653138623124551,0.7312992967830598,0.7770240761145776,0.7534686137687542
496,"For longer-term CDs , yields were up .",1.0,0.2,0.8888888888888888,0.7272727272727271,0.7999999999999999
497,"The average two-year and five-year jumbos were up 0.02 of a percentage point to 7.91 % and 7.96 % , respectively .",2.3356399084206436,0.3912856580261928,0.5563328782567037,0.6719850210477241,0.6087143419738071
498,"However , CDs sold through major broker-dealer networks were up slightly almost across the board .",2.041939653941069,0.39207296349518217,0.5791418790515053,0.6397232784315091,0.6079270365048178
499,"The average six-month CD in that category added 0.05 percentage point to 8.35 % , for example .",2.020251554255571,0.3627637744195287,0.6300382225003983,0.6446005995747056,0.6372362255804712
500,Mr. Mehl attributed the rise specifically to the Treasury bill increase .,1.125814583693911,0.19713859726136096,0.8730552662007037,0.7431147865896833,0.8028614027386389
501,"Among the major banks surveyed by Banxquote in six regions of the country , 8.33 % is the highest yield available .",2.7393028412041094,0.47100045081875613,0.5081680393223071,0.5516119713123666,0.5289995491812438
502,It is offered by the flagship banks of New York 's Manufacturers Hanover Corp. in the one-year maturity only .,1.6069482743708807,0.2496459939290685,0.762796075782997,0.7383113106662822,0.7503540060709314
503,The yield is offered across a range of maturities at San Francisco 's BankAmerica Corp. and Wells Fargo & Co .,1.6869486650105037,0.2662573964510306,0.8262506239088929,0.659863488362989,0.7337426035489696
504,"Just two weeks ago , BankAmerica 's yields in many of those maturities was 8.61 % .",1.5738169118919698,0.2384170548589283,0.7532256092101054,0.7701278177583721,0.7615829451410718
505,"Still , on average , the major California banks have the highest yields on CDs , according to Banxquote .",1.718226398830013,0.2899651951689139,0.7293924036914008,0.6916781185112982,0.7100348048310859
506,The average yield there on six-month issues is 8.32 % .,1.1595352274694068,0.20133168756759667,0.7429097216466912,0.8634759182215924,0.7986683124324034
507,I had to reach back to French 101 when the monsieur avec clipboard leaned over my shoulder during the coffee phase of dinner and asked whether I wanted to ride in a montgolfiere .,2.6013374109963063,0.39086268656989653,0.6001546699224589,0.6183929329270715,0.6091373134301037
508,"I was a last-minute -LRB- read interloping -RRB- attendee at a French journalism convention and so far the festivities had been taken up entirely by eating , drinking , smoking , sleeping and drinking .",2.7652619543289085,0.45170176209161156,0.5478465861309609,0.5487506349953366,0.5482982379083884
509,The man with the clipboard represented a halfhearted attempt to introduce a bit of les sportif into our itinerary .,2.611941547876374,0.4478703321738193,0.5544600360281603,0.5498188064832112,0.5521296678261806
510,"But as the French embody a Zen-like state of blase when it comes to athletics -LRB- try finding a Nautilus machine in Paris -RRB- , my fellow conventioners were having none of it .",2.868324808019758,0.4124913977082426,0.6114173946402571,0.5653992961387597,0.5875086022917573
511,"The diners at my table simply lit more Gauloises and scoffed at the suggestion of interrupting a perfectly good Saturday morning to go golfing or even montgolfing -LRB- ballooning to you ; the brothers Montgolfier , French of course , were the world 's first hot-air balloonists -RRB- .",3.476483494098961,0.5034151780827968,0.5147588732566982,0.4796503117163644,0.4965848219172033
512,Back in the U.S.A. this kind of chi-chi airborne activity wins heartwarmingly covetous responses .,1.6176441670993595,0.2610730138476417,0.7968401162357457,0.6888615727064878,0.738926986152358
513,As in : `` You went ballooning ? ? ! !,1.5917977276660857,0.32070523842530113,1.0,0.5143424450898926,0.6792947615746989
514,In France ? ? ! ! '',1.3728057820624016,0.37401306331265805,0.9999999999999999,0.4555902366591241,0.625986936687342
515,Americans it seems have followed Malcolm Forbes 's hot-air lead and taken to ballooning in a heady way .,1.7776019742535443,0.2731525225528403,0.7196011569919801,0.7342412220719974,0.7268474774471598
516,"During the past 25 years , the number of balloonists -LRB- those who have passed a Federal Aviation Authority lighter-than-air test -RRB- have swelled from a couple hundred to several thousand , with some estimates running as high as 10,000 .",3.218575740741927,0.4657068590708906,0.540307870881694,0.5284108491233169,0.5342931409291095
517,"Some 30 balloon shows are held annually in the U.S. , including the world 's largest convocation of ersatz Phineas Foggs -- the nine-day Albuquerque International Balloon Fiesta that attracts some 800,000 enthusiasts and more than 500 balloons , some of which are fetchingly shaped to resemble Carmen Miranda , Garfield or a 12-story-high condom .",3.6814494862761635,0.5118801623584562,0.5038077207924788,0.4733794492370095,0.48811983764154365
518,-LRB- The condom balloon was denied official entry status this year . -RRB-,2.0280406135846367,0.37746165118841507,0.7310127657519712,0.5420969962780169,0.6225383488115847
519,"But in Epinal , a gray 16th-century river town adjacent to France 's Vosges mountain region , none of these Yankee-come-lately enthusiasms for things aloft was evident .",2.795738390624783,0.4374903573677644,0.6002891410329516,0.5292039278065174,0.5625096426322358
520,Ballooning at the de rigueur hour of 6 a.m. held all the attraction for most people of sunrise root-canal work .,2.4236474739161786,0.41022167503359486,0.6326427492817672,0.5523538395405243,0.5897783249664049
521,"Feeling the naggings of a culture imperative , I promptly signed up .",1.8084442311020728,0.3233733006735532,0.6957670341262344,0.658511259309317,0.6766266993264468
522,"The first thing anybody will tell you about ballooning is that it requires zip in the way of athletic prowess , or even a measure of derring-do .",2.098960711898819,0.3135762078200591,0.7252837362536818,0.6515162337433277,0.6864237921799404
523,-LRB- So long as you do n't look down . -RRB-,1.228161364029722,0.21581896071624931,0.8598653373189792,0.7207421908807412,0.7841810392837508
524,"They will also tell you that even if you hate heights , you can still balloon .",1.9926060577016025,0.3638507954690045,0.6619998665681589,0.6122415713931911,0.6361492045309958
525,-LRB- I still say do n't look down .,0.8888888888888902,0.16307012108499616,0.9112268122170702,0.7738351806137472,0.836929878915004
526,At least not when you are ascending . -RRB-,0.44444444444444464,0.07538827312875093,0.924611726871249,0.924611726871249,0.924611726871249
527,What they wo n't tell you is not to go aloft in anything you do n't want to get wet .,2.6294895689939817,0.4941398921086574,0.4956997951183348,0.5164456464570981,0.5058601078913425
528,I 'm not referring to the traditional champagne drenching during the back-on-terra-firma toast .,1.3396348215831058,0.21348506858847713,0.8119774209430989,0.7626008237161512,0.7865149314115232
529,I 'm talking about landing in a canal .,0.2222222222222232,0.03917064001854877,0.9246117268712492,1.0,0.9608293599814515
530,In a porous wicker basket .,0.3333333333333339,0.06891905627081008,1.0000000000000002,0.8710490642551529,0.9310809437291903
531,With a pilot who speaks no English .,0.25,0.047619047619047616,0.9090909090909091,1.0,0.9523809523809523
532,"To wit , my maiden voyage -LRB- and novitiates are referred to as virgins -RRB- began at dawn on a dew-sodden fairway and ended at noon in a soggy field .",3.3363200633942123,0.5283997171998287,0.5219947567676384,0.4300795013135922,0.47160028280017124
533,"-LRB- Balloon flights almost always occur at dawn or dusk , when the winds are lightest . -RRB-",2.19355241418689,0.4003102481533251,0.6073568087051173,0.5922138542721628,0.5996897518466748
534,In between came lots of coffee drinking while watching the balloons inflate and lots of standing around deciding who would fly in what balloon and in what order -LRB- the baskets hold no more than four passengers -RRB- .,2.959979241886292,0.4715225932137153,0.5230333822137104,0.5340359522743655,0.5284774067862846
535,"When it was n't my turn in the balloon I followed its progress from the `` chase car , '' listening to the driver holler into a walkie-talkie .",2.5044548442445063,0.379019413900364,0.696921685932225,0.5599633530905126,0.6209805860996362
536,After long stretches of this attendant ground activity came 20 or so lovely minutes of drifting above the Vosges watching the silver mists rise off the river and the French cows amble about the fields .,2.6545802070177276,0.4238842513232081,0.5878846649527472,0.5648087904200871,0.5761157486767919
537,"It 's hard not to feel that God 's in his heaven with this kind of bird's-eye view of the world , even if your pilote in silly plaid beret kept pointing out how `` belle '' it all was .",3.401585902012886,0.51301396201607,0.4766809700425165,0.4977465086371852,0.48698603798393014
538,Eventually little French farmers and their little French farmwives came out of their stone houses and put their hands above their tiny eyes and squinted at us .,3.0754690692305258,0.5279815959497345,0.4911857209158205,0.4542908201092825,0.4720184040502655
539,No wonder .,4.440892098500626e-16,1.4009454786722165e-16,1.0,1.0,1.0
540,We were coming down straight into their canal .,0.8888888888888893,0.163070121084996,0.8369298789150039,0.8369298789150039,0.8369298789150039
541,"See , the other rule of thumb about ballooning is that you ca n't steer .",1.4387218755408666,0.23736278817749323,0.7324279104423734,0.795445709174089,0.7626372118225064
542,And neither can your pilot .,0.0,0.0,1.0,1.0,1.0
543,"You can go only up or down -LRB- by heating the balloon 's air with a propane burner , which does make the top of your head feel hot -RRB- and ride the air currents .",3.3745539848712225,0.5120700218842607,0.4863823361398686,0.48948750055484525,0.4879299781157392
544,Which makes the chase car necessary .,0.9649839288804953,0.20753565833176302,0.7306239305568805,0.8657411483701791,0.792464341668237
545,"Most balloonists seldom go higher than 2,000 feet and most average a leisurely 5-10 miles an hour .",2.0838763891292755,0.3331018507730504,0.7076862114520818,0.6305555731824122,0.6668981492269498
546,When the balloon is cruising along at a steady altitude there is little sense of motion .,1.6626272062641414,0.27519148386116504,0.7229456174528586,0.7266810403266405,0.7248085161388349
547,"Only when one is ascending -- or in our case descending a tad trop rapidement -- does one feel , well , airborne in a picnic basket .",2.6679723001513462,0.40931333337010495,0.5578156517955657,0.6276743198301046,0.5906866666298953
548,"`` What 's he doing ? '' hissed my companion , who was the only other English-speaking member of the convention and whose knuckles were white .",2.708719552213603,0.4362947179525691,0.5733260447074293,0.5544020752020982,0.5637052820474311
549,"`` Attention , '' yelled our pilot as our basket plunged into the canal .",1.984962500721156,0.37484052298177784,0.6351149965655483,0.6155112490521464,0.625159477018222
550,"`` You bet attention , '' I yelled back , leaping atop the propane tanks , `` I 'm wearing alligator loafers ! ''",2.4428829367954465,0.38207604372581055,0.7534988435165183,0.5236967085242162,0.6179239562741895
551,"Our pilot simply laughed , fired up the burner and with another blast of flame lifted us , oh , a good 12-inches above the water level .",2.187897318887144,0.3433131022054437,0.6958459320716668,0.6217004338692717,0.6566868977945561
552,We scuttled along for a few feet before he plunged us into the drink again .,1.7971804688852169,0.3019040741100141,0.675094660394919,0.7227198369094898,0.698095925889986
553,Eventually we came to rest in a soggy patch of field where we had the exquisite pleasure of scrambling out of the basket into the mud while the French half of our ballooning tag team scrambled in .,2.9959358523718973,0.4865665350221888,0.5182643652798646,0.5086917935381231,0.513433464977811
554,I looked at my watch .,0.666666666666667,0.1480409554829327,0.8519590445170674,0.8519590445170674,0.8519590445170674
555,Barely half-an-hour aloft .,0.5,0.14285714285714285,1.0,0.75,0.8571428571428571
556,"Back in the chase car , we drove around some more , got stuck in a ditch , enlisted the aid of a local farmer to get out the trailer hitch and pull us out of the ditch .",2.929019379544276,0.4700700554921143,0.5305641805386004,0.529297222997283,0.5299299445078858
557,"We finally rendezvoused with our balloon , which had come to rest on a dirt road amid a clutch of Epinalers who watched us disassemble our craft -- another half-an-hour of non-flight activity -- that included the precision routine of yanking the balloon to the ground , punching all the air out of it , rolling it up and cramming it and the basket into the trailer .",3.667909486868026,0.5827431046772369,0.424690153335029,0.41007936668421774,0.4172568953227631
558,It was the most exercise we 'd had all morning and it was followed by our driving immediately to the nearest watering hole .,1.848521999025012,0.28770043315542243,0.7106197081038017,0.7139873865580413,0.7122995668445776
559,"This meant returning to the golf course , where we watched a few French duffers maul the first tee while we sat under Cinzano umbrellas , me nursing an espresso and my ego .",2.8713427325129506,0.44926200161064594,0.5608453610659107,0.5409884894405308,0.550737998389354
560,A whole morning of ballooning and I had been off the ground barely 30 minutes .,1.5,0.24,0.7307692307692308,0.7916666666666667,0.76
561,"Still , I figured the event 's envy-quotient back in the U.S.A. was near peerless .",1.6415414066556497,0.2581665638860834,0.7782050402297956,0.7087098838422563,0.7418334361139167
562,"As for the ride back to camp , our pilot and all the other French-speaking passengers clambered into the chase car .",2.618620021565308,0.4605250036466921,0.5293598476222954,0.5499842414865325,0.5394749963533078
563,My American companion and I were left to ride alfresco in the wicker basket .,0.9836591668108969,0.1440178028000054,0.8796352259629645,0.8335678998535678,0.8559821971999945
564,"As we streaked by a blase gendarme , I could n't resist rearing up on my soggy loafers and saluting .",1.881417857348901,0.28027565997847653,0.7096559810683369,0.7300825035647448,0.7197243400215235
565,Ms. de Vries is a free-lance writer .,1.0943609377704333,0.22308223737786706,0.7921550211540895,0.7622556248918265,0.7769177626221329
566,"Treasury Undersecretary David Mulford defended the Treasury 's efforts this fall to drive down the value of the dollar , saying it helped minimize damage from the 190-point drop in the stock market Oct. 13 .",2.464695998700015,0.3866755171472564,0.6546649147737271,0.5768950227210704,0.6133244828527434
567,"Testifying before a House subcommittee , Mr. Mulford said that if the Treasury had n't intervened in foreign-exchange markets in September and early October to reduce the dollar 's value , the plunge in the stock market might have provoked a steep fall in the currency that might have `` unhinged financial markets . ''",2.934662705608642,0.4383417127519664,0.5604699518640306,0.5628516724707703,0.5616582872480337
568,"Mr. Mulford , responding to critics of intervention , also said intervention is `` highly visible , '' is taken seriously by financial markets and works better than `` was recognized some time ago . ''",2.8466779410476026,0.42926491131449535,0.60485739951715,0.5402571254837892,0.5707350886855048
569,Differences between the Treasury and the Federal Reserve on the usefulness of intervention to help restrain the dollar resurfaced at the hearing .,2.445166563370761,0.4021511195121228,0.660262197373195,0.5462161201532373,0.5978488804878771
570,"Fed Vice Chairman Manuel Johnson , who had dissented from the Treasury 's policy , told lawmakers , `` I became convinced about what looked to me like an attempt to push the dollar down against the fundamentals in the market . ''",2.9247585672757657,0.43016330086358234,0.603313523112642,0.5398797078607311,0.5698366991364177
571,"Intervention , he added , is useful only to smooth disorderly markets , not to fundamentally influence the dollar 's value .",2.3756664775677447,0.4084761878455046,0.6093118508778591,0.5747449087439283,0.5915238121544951
572,"Rep. John LaFalce -LRB- D. , N.Y . -RRB- said Mr. Johnson refused to testify jointly with Mr. Mulford and instead asked to appear after the Treasury official had completed his testimony .",2.1760415580198957,0.3277746325343956,0.7354319246859675,0.6190235094080337,0.6722253674656044
573,A Fed spokesman denied Mr. LaFalce 's statement .,0.7505430557959416,0.14588204357457457,0.9081491772631822,0.8061549798191673,0.8541179564254255
574,"Mr. Mulford said reports of tension between the Treasury and Fed have been exaggerated , insisting that they involved `` nuances . ''",2.359333152456106,0.36220101992332715,0.651919686222812,0.6242770194251018,0.6377989800766729
